Diet_type,Cuisine_type,Protein,Carbs,Fat,Calories,Recipe_name
30,60,230.26,4.42,149.39,2283.23,Keto Spinach Stuffed Chicken
30,60,120.21,1.61,211.79,2393.39,Keto Pizza Chips recipes
30,60,121.29,8.74,78.52,1226.8,Keto Chicken Crust Pizza
30,60,84.89,169.9,158.46,2445.3,Keto Broccoli Cheddar Soup
30,60,163.99,16.37,220.17,2702.97,Keto Sausage Egg Casserole
30,60,62.81,84.39,64.27,1167.23,Keto Brussel Sprouts Casserole
30,60,22.27,30.04,55.67,710.27,Keto Parmesan Cauliflower Risotto
30,60,34.24,7.21,47.55,593.75,Cheesy Keto Pizza Crust
30,60,57.18,39.42,113.75,1410.15,Keto Fried Mozzarella Bites
30,60,136.12,26.1,214.11,2575.87,Keto Chicken-Broccoli Casserole
30,60,92.48,32.8,148.68,1839.24,Keto Spinach Pesto Flatbread
30,60,77.72,59.31,169.34,2072.18,Keto Flatbread Pizza Recipe
30,60,23.3,37.68,44.5,644.42,Garlic Parmesan Keto Croutons
30,60,64.92,1.03,105.03,1209.07,Keto Pizza in a bowl
30,60,56.61,8.61,63.76,834.72,Keto Garlic Gnocchi recipes
30,60,91.37,253.9,138.47,2627.31,Keto Pumpkin Carbonara recipes
30,60,187.41,497.15,156.57,4147.37,Keto Spaghetti alla Carbonara
30,60,93.66,25.74,125.36,1605.84,Keto Pesto Chicken Pasta
30,60,176.23,91.02,205.88,2921.92,Keto chicken parmi bowl
30,60,59.28,7.53,26.75,507.99,Easy Keto Marinara Chicken
30,60,95.72,68.1,207.92,2526.56,Keto-Pesto-Cauliflower-Casserole
30,60,128.65,15.66,174.49,2147.65,Keto Spinach Pizza Frittata
30,60,220.56,91.59,238.69,3396.81,Keto Eggplant Lasagna Recipe
30,60,99.69,17.75,138.94,1720.22,Keto Egg Casserole Bake
30,60,38.48,33.93,54.81,782.93,Keto Spaghetti Squash Carbonara
30,60,72.25,19.07,109.24,1348.44,Keto Pepperoni Pizza Cups
30,60,99.96,9.57,70.32,1071,Keto Pesto Chicken with Mozzarella
30,60,185.08,40.1,277.66,3399.66,Keto Chicken Broccoli Casserole
30,60,30.6,66.58,8.2,462.52,Keto Creamy Broccoli Soup
30,60,80.58,37.67,111.44,1475.96,Keto Cauliflower Pizza Muffins
30,60,155.64,87.18,172.22,2521.26,Keto Stuffed Pepper Casserole
30,60,152.56,28.64,248.55,2961.75,Keto Chicken Pizza Dip
30,60,120.78,163.57,298.48,3823.72,Keto Almond Ricotta Cake
30,60,128.84,27.69,112.92,1642.4,Keto Scampi-Style Chicken
30,60,23.48,45.71,95.98,1140.58,Keto Bruschetta Stuffed Avocado
30,60,92.87,25.36,124.34,1591.98,Chicken Roulades (Keto-friendly!)
30,60,246.2,29.8,147.47,2431.23,Keto Tuscan Garlic Chicken
30,60,69.2,44.59,135.46,1674.3,Creamy Keto Cauliflower Risotto
30,60,128.57,30.32,213.79,2559.67,Easy Weeknight Keto Pizza
30,60,98.45,55.02,234.93,2728.25,Keto Zuppa Toscana Soup
30,60,43.64,48.26,95.41,1226.29,Keto Butternut Squash Risotto
30,60,159.45,35.97,273.25,3240.93,Keto Chicken and Broccoli Casserole
30,60,47.93,14.09,203.9,2083.18,5 Minute Keto Pesto recipes
30,60,308.21,32.78,328.73,4322.53,Low Carb Lasagna Meatballs Recipe
30,60,65.2,23.02,108.07,1325.51,Low Carb/Keto pizza crust
30,60,112.53,258.9,128.67,2643.75,Keto Pizza Florentine recipes
30,60,243.63,41,432.48,5030.84,KETO Shrimp and Asparagus Alfredo
30,60,284.21,119.23,401.06,5223.3,Low-Carb Keto Lasagna
30,60,162.11,44.11,79.41,1539.57,Easy Keto Mozzarella Chicken
30,60,154.43,60.76,219.59,2837.07,Keto Chicken and Rice Casserole
30,60,29.07,23.2,33.98,514.9,5 Minute Keto Pizza recipes
30,60,342.16,63.19,560.81,6668.69,Keto Bacon Cheeseburger Casserole
30,60,56.2,7.18,60.85,801.17,Magic Low-Carb Keto Gnocchi
30,60,26.61,124.82,115.33,1643.69,Sara Louise's Keto Matboucha
30,60,351.06,56.31,598.18,7013.1,Keto Cheeseburger Casserole with Bacon
30,60,68.94,22.73,85.55,1136.63,Low-carb keto-friendly pizza
30,60,230.26,4.42,149.39,2283.23,Keto Spinach Stuffed Chicken recipes
30,60,4.9,9.47,88.06,850.02,No-Churn Keto Ice Cream
30,60,34.9,46.14,19.99,504.07,PERFECT KETO CAULIFLOWER PIZZA CRUST
30,60,134.66,68.36,106.66,1772.02,"Chicken Alfredo Bake Recipe {Paleo, Clean Eating, Gluten-Free, Dairy-Free, Whole30} recipes"
30,60,18.18,24.5,63.28,740.24,Parmesan Garlic Keto-Friendly Zoodles
30,60,221.16,147.15,286.38,4050.66,Keto Parmesan-Breaded Eggplant Pizzas
30,60,274.34,196.1,288.84,4481.32,Keto Spaghetti Squash Lasagna Boats
30,60,50.46,15.03,72.79,917.07,Low-carb keto pizza dough
30,60,65.08,20.28,43.97,737.17,Keto Low Carb Cauliflower Pizza
30,60,193.22,72.22,121.77,2157.69,Chicken Parmesan Casserole - Low Carb &
30,60,32.89,19.54,68.87,829.55,Keto Creamy Spinach Egg Casserole
30,60,60.43,28.29,89.31,1158.67,Keto Pepperoni Pizza Cauliflower Casserole
30,60,69.15,5.93,102.39,1221.83,low carb keto stuffed eggs
30,60,120.23,23.36,100.03,1474.63,Keto Cheesy Spinach and Egg Casserole
30,60,160.92,26.9,194.95,2505.83,Keto White Pizza Frittata recipes
30,60,145.34,20.19,197.97,2443.85,Keto Pesto-stuffed Chicken Thighs
30,60,75,47.1,158.3,1913.1,Hot Melt (keto-approved) Spaghetti
30,60,145.9,45.31,127.07,1908.47,Stuffed portobello Caps Keto style
30,60,172.39,57.04,341.32,3989.6,Fathead Keto Gnocchi - Low Carb
30,60,108.42,64.15,279.58,3206.5,Creamy Keto Tuscan Soup Recipe
30,60,5.24,13.36,88.21,868.29,Keto No-Churn Strawberry Ice Cream
30,60,146.22,58.28,151.35,2180.15,Pesto Keto Chicken Stuffed Peppers
30,60,315.23,34.66,147.1,2723.46,Keto Italian Chicken Salad recipes
30,60,65.96,38.66,73.02,1075.66,Keto Mini Pepper Pizza Cups
30,60,168.26,44.33,138.35,2095.51,Keto Chicken Pesto Cauliflower Casserole
30,60,109.02,41.52,108.35,1577.31,Keto Crustless Mushroom Spinach Pie
30,60,199.82,51.36,148.43,2340.59,Easy Keto Spinach Cheese Manicotti
30,60,85.1,38.27,146.3,1810.18,Deep Dish Skillet Keto Pizza
30,60,90.86,130.47,428.13,4738.49,Keto Fat Bombs with Cacao and Cashew
30,60,190.8,64.39,216.6,2970.16,Keto Zucchini Rollatini - Low Carb
30,60,90.79,24.77,128.9,1622.34,Keto Creamy Asparagus and Shrimp Alfredo
30,60,129.07,33.43,145.31,1957.79,Ham and Cheese Keto Stromboli recipes
30,60,217.33,51.8,278.81,3585.81,Keto Pepperoni Pizza with Fathead Crust
30,60,217.65,84.99,388.93,4710.93,Keto Cauliflower Pizza Casserole recipes
30,60,118.99,74.23,176.92,2365.16,"Keto Sriracha “Spaghetti"" + Meatballs recipes"
30,60,52.74,87.16,112.08,1568.32,Thin Keto Pizza Crust recipes
30,60,151.43,229.41,179.32,3137.24,Bacon Cheeseburger Pizza - Keto Recipe
30,60,29.48,34.96,231.05,2337.21,Sara Louise's Keto Creamed Spinach
30,60,84.77,53.03,158.48,1977.52,Keto Italian Cheese Stuffed Mushrooms
30,60,124.29,29.7,168.16,2129.4,Keto Fat Head Dough Pizza Recipe
30,60,65.89,89.94,142.27,1903.75,Sara Louise's Keto Stuffed Peppers
30,60,43.03,160.97,245.96,3029.64,No Churn Keto Chocolate Ice Cream
30,60,153.39,40.88,214.66,2709.02,Keto Fathead Pizza with Chorizo and Salsa
30,60,162.32,55.35,243.42,3061.46,Easy Keto Lasagna Stuffed Portobellos - Lo
30,60,99.78,20.24,87.74,1269.74,Keto Mozzarella and Tomato Broiled Shrimp
30,60,110.12,44.45,220.02,2598.46,"Keto Cauliflower Casserole, The Perfect Sidedish"
30,60,227.07,34.74,269.1,3469.14,Keto Green Bean Skillet Pizza recipes
30,60,82.19,47.82,150.11,1871.03,"Sausage, Zucchini, and Cauli Keto Risotto"
30,60,131.04,20.47,154.99,2000.95,Keto Chicken Thighs with Charred Lemon
30,60,250.23,41.75,93.5,2009.42,Sara Louise's Keto Chicken Saltimbocca
30,60,59.73,32.92,71.87,1017.43,Portobello Pizza Keto Stuffed Mushrooms Recipe
30,60,32.18,37.9,17.21,435.21,No Eggs! Keto Mini Pizzas recipes
30,60,19.66,19.02,50.1,605.62,Keto Pesto Shrimp Skewers - Low Carb
30,60,184.18,12.71,98.31,1672.35,Keto Pizza – Turkey Crust Meatza recipes
30,60,93.63,61.71,187.39,2307.87,Keto Twice Baked Cauliflower Casserole recipes
30,60,8.13,44.53,62.07,769.27,Keto Spaghetti Squash Puttanesca - Low Carb
30,60,104,144.34,186.68,2673.48,Low Carb Keto Mexican Pizza #ketolicious
30,60,59.87,8.27,115.24,1309.72,Keto Low-Carb Roasted Garlic Gnocchi
30,60,18.06,40.33,103.34,1163.62,Sara Louise's Keto Cream Of ”Risotto”
30,60,5.91,75.3,169.73,1852.41,Keto Chocolate Peanut Butter Fatbombs recipes
30,60,33.92,34.2,67.44,879.44,Keto Spaghetti Squash Primavera - Low Carb
30,60,139.89,240.56,195.19,3278.51,Easy Four Cheese Pesto Zoodles - Keto
30,60,288.53,80.47,314.77,4308.93,Italian Meatball Casserole {Keto/Low Carb}
30,60,11.46,27.52,84.72,918.4,"Keto Creamy Spinach, Mushroom, and Tomato Risotto"
30,60,13.56,82.23,30.98,661.98,Sara Louise's Keto Roasted Red Peppers
30,60,306.99,25.95,216.65,3281.61,Low Carb Keto Chicken Parmesan Recipe
30,60,7.55,1.49,126.42,1173.94,SUGAR FREE KETO ALMOND CHOCOLATE FUDGE (Ma
30,60,129.5,33.88,262.29,3014.13,Easy Bacon Cheeseburger Soup (Keto Friendl
30,60,164.03,17.95,176.27,2314.35,"Crispy Chicken Thighs | Keto, Paleo, Whole 30"
30,60,67.87,165.33,251.08,3192.52,Sara Louise's Keto Cheesy Squash Casserole
30,60,28.81,31.47,81.97,978.85,Keto Spaghetti Squash with Bacon and Blue Cheese
30,60,239.49,58.31,65.29,1778.81,"Spaghetti Squash Chow Mein | Keto, Paleo"
30,60,113.22,28.98,68.25,1183.05,BEST KETO ITALIAN RAGÚ aka BOLOGNES
30,60,128.97,82.16,146.26,2160.86,Pull-Apart Keto Pizza Bread recipes
30,60,157.17,63.84,229.46,2949.18,"Sausage Stuffed Portobello Mushrooms (Paleo, Whole30 + Keto)"
30,60,52.67,21.36,49.83,744.59,"Whole30 + Paleo Frittata {Dairy-Free, GF, Keto}"
30,60,203.78,144.66,305.14,4140.02,Sara Louise's Keto Beef Zucchini Lasagna
30,60,95.67,97.25,191.06,2491.22,Low Carb Keto Asiago Alfredo Brussels Sprouts
30,60,96.71,72.16,111.75,1681.23,Keto Egg Roll in a Bowl [Recipe] recipes
30,60,766.99,41.29,287.59,5821.43,"Mayo Free Deviled Eggs (Paleo, Whole30 + Keto)"
30,60,219.29,29.05,302.26,3713.7,Low/Carb - Keto Friendly Cauliflower Crust Pizza
30,60,96.92,47.95,231.94,2666.94,"Chicken Alfredo Spaghetti Squash Low-Carb, Keto"
30,60,153.22,37.26,235.3,2879.62,"Bacon Sausage and Zucchini Casserole (Paleo, Whole30 + Keto)"
30,60,50.36,24.7,43.33,690.21,"5-Min Prosciutto Avocado Fat Bomb Recipe [Paleo, Keto]"
30,60,108.02,12.96,151.9,1851.02,Keto Pork Chops al Pastor - Low Carb
30,60,34.81,20.43,18.95,391.51,Keto Grain-free Bacon and Shrimp Risotto recipes
30,60,114.37,32.89,177.04,2182.4,Keto Low-Carb Creamy Garlic Shrimp Alfredo
30,60,141.3,117.92,276.21,3522.77,Low Carb and Keto Chicken Alfredo Pasta Re
30,60,220.23,57.19,115.84,2152.24,Sara Louise's Keto Korean Beef Zo Mein
30,60,2.05,7.75,11.34,141.26,"Paleo Passion Fruit Side Salad Recipe [Keto, AIP]"
30,60,125.05,28.72,160.02,2055.26,Keto Fathead Pizza and Pigs in a Blanket (GAPS too!)
30,60,4.57,13.59,29.47,337.87,"Raw Italian Cauliflower Salad Recipe [Paleo, Keto, AIP]"
30,60,33.04,54.69,37.79,691.03,"Keto Cauliflower Pizza Crust | Thin, Crispy, Dairy Free"
30,60,118.21,93.01,118.82,1914.26,Keto BBQ Chicken Pizza (Dairy Free Crust) recipes
30,60,111.85,23.42,244.27,2739.51,keto Low Carb Hot Tuscan Chicken casserole #ketolicious
30,60,9.5,11.52,12.53,196.85,"Easy Keto Basil Pesto Recipe [Dairy-Free, No Cheese]"
30,60,105.64,79.35,132.76,1934.8,Paleo Beef with Broccoli (Whole30/Keto friendly) recipes
30,60,151.15,101.29,398.5,4596.26,"Slow Cooker Zuppa Toscana (low carb, keto friendly)"
30,60,147.72,89.22,188.27,2642.19,Keto Low Carb Pizza Casserole Recipe (Easy) - 5 Ingredients
30,60,104.51,28.37,114.97,1566.25,Easy Keto Low Carb Meatballs Recipe - Italian Style
30,60,284.3,60.25,99.57,2274.33,"Chicken Skillet with Bacon Brussels Sprouts (Paleo, Whole30 + Keto)"
30,60,248.2,64.35,171.14,2790.46,Chicken Parmigiana (Keto/Gluten-free/Low-carb) recipes
30,60,2.59,27.92,16.12,267.12,"Coconut Oil Baked Spaghetti Squash Recipe [Paleo, AIP, Keto]"
30,60,114.07,102.01,147.95,2195.87,"Keto Chicken Cauliflower Casserole Recipe [Dairy-Free, Paleo]"
30,60,138.46,38.44,208.23,2581.67,"Low Carb Mexican Pizza - Keto, Gluten Free recipes"
30,60,270.18,78.05,406.22,5048.9,Keto Pizza Cauliflower Casserole (low carb and gluten free)
30,60,47.53,71.41,39.84,834.32,Broccoli Kale Pizza Crust Recipe | Crispy Keto Pizza Crust
30,60,26.2,35.95,110.12,1239.68,"BLTA Stuffed Tomatoes - Low Carb, Paleo, Keto, GF recipes"
30,60,53.33,34.03,79.24,1062.6,Ultimate Keto Fathead Cauliflower Pizza Crust in the Known Universe
30,60,107.72,67.4,185.7,2371.78,Keto Broccoli Cheddar Muffins (Gluten-free/Low Carb) recipes
30,60,6.29,16.14,204.76,1932.56,Have A Very Keto Christmas With These 4-Ingredient Chocolate Orange Fat Bombs
30,60,126.73,77.95,197.8,2598.92,"Aunt Rocky’s Chorizo and Spaghetti Squash Casserole (Low Carb, Keto)"
30,60,93.72,34.87,119.12,1586.44,"Keto Asian Meatballs Recipe with Dipping Sauce [Paleo, Dairy-Free]"
30,60,139.68,44.42,177.88,2337.32,"The Best Keto Pizza - Gluten-Free, Low Carb and Protein-Packed! recipes"
30,60,137.72,43.49,113.95,1750.39,Easy keto and Low Carb Chicken Broccoli Casserole (Paleo and Gluten Free)
30,60,25.66,8.52,60.58,681.94,Egg Fast Recipe – Tex Mex White Egg Pizza a Low Carb Keto Pizza Bonanza! recipes
30,60,137.39,14.28,147.09,1930.49,Egg and mozzarella pizza crust (1/2 pie)
30,60,83.43,479.9,34.44,2563.28,Fathead pizza crust
30,60,375.92,8.09,64.63,2117.71,Tuscan Pork Tenderloin
30,60,107.46,42.39,203.11,2427.39,Aunt Rocky’s Spaghetti Squash Carbonara
30,60,75.92,4.27,121.14,1411.02,Beef Crust for Pizza
30,60,225.2,10.55,94.58,1794.22,No Carb (No Cauliflower) Pizza Crust
30,60,225.2,10.55,94.58,1794.22,No Carb (No Cauliflower) Pizza Crust
40,60,76.64,429.13,58.98,2553.9,Easy Stuffed Peppers
40,60,218.34,271.22,268.81,4377.53,Mediterranean Lasagna
40,60,216.49,528.48,215.02,4915.06,Flatbread Pizza With Prosciutto & Gorgonzola
40,60,62.07,192.5,41.81,1394.57,Mediterranean Pizza
40,60,64.24,213.66,49.41,1556.29,Mediterranean Pizza
40,60,74.32,394.77,69.24,2499.52,Mediterranean Pizza
40,60,83.82,325.59,120.42,2721.42,Mediterranean Risotto
40,60,131.92,106.72,28.87,1214.39,Middle Eastern Salad Bowls with Farro & Chicken
40,60,112.38,549.98,90.39,3462.95,Mediterranean Focaccia
40,60,274.45,491.11,321.61,5956.73,Mediterranean Pizza
40,60,24.37,84.92,9.07,518.79,Orecchiette with Mixed Greens and Goat Cheese
40,60,119.01,180.49,96.61,2067.49,Mediterranean Pressed Sandwich
40,60,83.4,75.67,97.28,1511.8,Mediterranean Cauliflower Pizza
40,60,92.57,283.83,44.19,1903.31,Mediterranean Style Linguini
40,60,31.3,117.03,38.37,938.65,Mini Mediterranean Pizzas
40,60,132.19,188.73,117.34,2339.74,Mediterranean Chicken Pizza
40,60,161.8,120.49,36.58,1458.38,Mediterranean Tuna Panini
40,60,58.32,28.12,39.16,698.2,Mediterranean-Style Frittata
40,60,98.21,362.25,126.16,2977.28,Penne Rigate with Mixed Greens and Pine Nuts
40,60,63.36,103.49,44.53,1068.17,Chicken-Arugula Focaccia Sandwiches
40,60,39.62,102.71,97.15,1443.67,Mediterranean fig & mozzarella salad
40,60,42.51,103,100.06,1482.58,Mediterranean fig & mozzarella salad
40,60,89.29,219.85,159.32,2670.44,Mediterranean Rice-Stuffed Escarole
40,60,145.7,594.59,261.44,5314.12,Eggplant Bruschetta with Pita Chips
40,60,40.38,134.05,69.41,1322.41,Mediterranean Tortellini Pasta Salad recipes
40,60,83.5,410.36,65.98,2569.26,Spaghetti Puttanesca
40,60,189.69,441.86,86.94,3308.66,Four-Cheese Baked Penne
40,60,189.69,441.8,117.57,3584.09,Four-Cheese Baked Penne
40,60,71.58,105.74,76.67,1399.31,Mediterranean Portobello Mushroom Pizzas with Arugula Salad
40,60,74.43,233.24,103.37,2161.01,Mediterranean Vegetable Sandwich with Sundried Tomato Pesto and Fresh Mozzarella
40,60,320.52,358.1,388.93,6214.85,Zucchini Pastitsio (Mediterranean Baked Beef and Pasta Casserole) Recipe
40,60,107.95,347.26,143.44,3111.8,"Chicken Sausage, Pepper And Onion Stoup With Tomato-Basil Gobble-'Ums"
40,60,283.8,82.89,71.18,2107.38,"Mediterranean Squid (calamari) filled with Shellfish, Saffron Risotto and Ink Sauce"
40,60,108.6,291.91,76.37,2289.37,Tuscan White Beans
40,60,20.87,51.53,38.62,637.18,Tortellini with pesto & broccoli
40,60,60.18,190.28,21.48,1195.16,Italian butter beans
40,60,51.2,6.31,100.89,1138.05,Olive-Garlic Deviled Eggs
40,60,75.66,6.74,405.28,3977.12,School of Tapas: Catalan cod brandada
40,60,38.37,116.47,15.47,758.59,Garlicky Escarole
40,60,75.33,300.22,104.05,2438.65,"Aubergine, chilli & bacon pasta"
40,60,329.78,282.19,732.29,9038.49,Lamb Chops with Asparagus and Farro
40,60,6.78,38.12,95.71,1040.99,Panzanella (Tuscan tomato and bread salad)
40,60,128.71,282.28,165.42,3132.74,Orzo & mozzarella salad
40,60,59.71,220.29,52.11,1588.99,Eggplant & Chickpea Baked Pasta
40,60,35.08,46.33,31.2,606.44,Portobello “Pizza” Margherita
40,60,47.39,131.33,35.18,1031.5,Roasted Vegetable and Prosciutto Lasagna with Alfredo Sauce
40,60,36.59,89.88,76.79,1196.99,Spicy Brussels Sprouts with Fried Capers
40,60,74.43,272.88,137.59,2627.55,Corn and Fregola with Grilled Halloumi Cheese
40,60,431.11,70.42,122.31,3106.91,Branzino al Forno
40,60,199.63,84.21,194.66,2887.3,Almond-Apricot Chicken with Mint Pesto
40,60,63.04,198.15,41.35,1416.91,Lamb & Eggplant Ragu
40,60,34.69,212.32,265,3373.04,Hazelnut Panna Cotta with Berry Compote
40,60,117.86,116.72,76.96,1630.96,"Mussels with Tomatoes, Wine, and Anise"
40,60,71.26,254.86,101.36,2216.72,"Stuffed Peppers, Tomatoes, and Mushrooms"
40,60,166.03,46.07,64.46,1428.54,Couscous-Stuffed Chicken
40,60,67.87,233.76,52.7,1680.82,Acorn Squash Stuffed with Chard & White Beans
40,60,205.84,145.35,50.36,1858,"Skillet Cod with Bulgur, Zucchini, and Tomatoes"
40,60,113.91,113.69,164.46,2390.54,Veal Meatballs with Braised Vegetables
40,60,35.82,115.03,31.12,883.48,"Dinner Tonight: Orzo with Cherry Tomatoes, Capers, and Lemon Recipe"
40,60,100.42,85.94,51.15,1205.79,"Swordfish with Olives, Capers & Tomatoes over Polenta"
40,60,71.31,218.32,60.34,1701.58,Falafel Pizza
40,60,54.18,114.77,258.04,2998.16,Roasted Tomatoes and Sage Pesto
40,60,96.31,318.46,47.83,2089.55,Honeyed Prawns & Polenta
40,60,110.38,202.45,185.25,2918.57,Irish Pizza
40,60,158.84,149.37,128.05,2385.29,Pita Panzanella Salad with Meatballs
40,60,398.42,444.69,118.77,4441.37,Linguine with Shellfish Sauce
40,60,502.47,659.32,429.03,8508.43,"Slow-Cooker Pork Shoulder With Tomatoes, Fennel, and Pasta Recipe"
40,60,63.35,183.09,112.59,1999.07,Cook the Book: Harissa Ravioli
40,60,94.42,262.65,113.23,2447.35,Cook the Book: Middle Eastern Lamb Pizza
40,60,82.98,25.84,105.67,1386.31,Capers: What's Not to Love? Recipe
40,60,309.78,107.85,55.37,2168.85,Italian Mixed Seafood Soup
40,60,442.1,603.47,503.79,8716.39,"Braised Chicken with Saffron Onions, Italian Couscous, and Dates"
40,60,54.84,188.68,89.59,1780.39,"Hummus Pizza, Mediterranean Style"
40,60,107.91,287.32,75.99,2264.83,3-Minute Mediterranean Vegetable Lasagne recipes
40,60,156.4,254.11,60.3,2184.74,Creamy Mediterranean Chicken Pasta Primavera
40,60,64.44,294.7,252.4,3708.16,Sam's Mediterranean Rotini Pasta Salad
40,60,164.08,374.81,182.37,3796.89,Mediterranean Pizza with Whole Wheat Crust
40,60,100.19,74.38,101.21,1609.17,Il Panino Toscano
40,60,219.7,16.96,119.67,2023.67,Italian Pork Chops
40,60,0.49,3.01,0.47,18.23,Italian Herb Seasoning
40,60,32.09,143.97,253.87,2989.07,Fried Provolone Stuffed Olives
40,60,42.2,192.58,63.85,1513.77,Warm Pasta Salad
40,60,69.95,117.51,42.43,1131.71,Egg Casserole for Two
40,60,69.95,117.51,42.43,1131.71,Egg Casserole For Two
40,60,51.98,75.46,20.73,696.33,Linguini with Coriander Pesto and Chilli Calamari
40,60,202.68,347.95,223.18,4211.14,Best Ever Gluten Free Veggie Supreme Pizza recipes
40,60,73.61,211.5,34.84,1454,Roasted vegetable & ham pasta salad
40,60,120.35,97.18,216.44,2818.08,Italian Sausage & Vegetable Stew recipes
40,60,93.01,295.81,63.97,2131.01,Fugazza
40,60,48.11,194.24,58.47,1495.63,Pasta with Olives and Tomatoes
40,60,126.18,271.03,129.4,2753.44,Mediterranean pizzas
40,60,43.65,124.89,46.1,1089.06,Mediterranean Pizza
40,60,86.73,313.4,95.07,2456.15,Mediterranean Pizzas
40,60,222.58,269.66,378.06,5371.5,Mediterranean Pizza
40,60,106.28,201.71,155.3,2629.66,Garmugia (Spring Vegetable Soup)
40,60,131.06,333.39,111.16,2858.24,Mediterranean Pizza
40,60,129.3,160.68,124.17,2277.45,Mediterranean Bruschetta
40,60,307.22,816.17,401.13,8103.73,Mediterranean Focaccia
40,60,86.73,313.4,95.07,2456.15,Mediterranean Pizzas
40,60,85.6,204.82,132.69,2355.89,Italian French Bread Pizza
40,60,177.78,408.92,203.05,4174.25,Crock Pot Pull Apart Pizza Bread recipes
40,60,628.29,3405.55,333.76,19139.2,Mediterranean Pizza
40,60,37.17,363.43,39.18,1955.02,Baked tomato and olive risotto
40,60,38.43,177.62,19.1,1036.1,Mediterranean Pizza
40,60,129.12,353.11,119.32,3002.8,Mediterranean Pizza
40,60,26.76,141.68,55.75,1175.51,Mediterranean Risotto
40,60,138.99,151.85,175.94,2746.82,Mediterranean Pizza
40,60,80.19,552.52,56.64,3040.6,Polenta Pizzas With Herbed Goat Cheese
40,60,63.3,180.81,48.55,1413.39,Mediterranean pizza
40,60,125.62,181.54,182.68,2872.76,Mediterranean pizza
40,60,140.17,273.14,161.53,3107.01,Mediterranean Pizza
40,60,50.08,160.41,50.8,1299.16,"Provence on a Plate - Roasted Eggplant, Tomato and Tapenade Pizza with Goat Cheese"
40,60,311.35,225.58,425.7,5979.02,Mediterranean Lasagna
40,60,172.43,252.29,163,3165.88,STEAK AND PESTO SPAGHETTI
40,60,111.85,173.92,211.19,3043.79,Mediterranean Ravioli
40,60,153.2,363.39,176.94,3658.82,Mediterranean Pizza
40,60,191.86,244.34,210.3,3637.5,Mediterranean Muffuletta
40,60,111.52,164.39,76.33,1790.61,Vanilla Shrimp Crostini
40,60,62.99,145.51,116.56,1883.04,Melanzane ripiene
40,60,69.48,26.37,114.28,1411.92,Italian Hoagie Sandwich recipes
40,60,48.11,194.24,58.47,1495.63,Pasta with Olives and Tomatoes
40,60,64.53,133.6,130.47,1966.75,"Roasted Acorn Squash Stuffed with Fennel Sausage, Farro, Goat Cheese & Spinach recipes"
40,60,57.6,308.47,47.09,1888.09,Squid ink fettuccine with crab and chilli
40,60,107.03,106.72,136.32,2081.88,Mediterranean Pita Pizza
40,60,45.14,415.71,64.81,2426.69,Mediterranean Polenta Rounds
40,60,77.34,272.43,86.57,2178.21,Mediterranean Pesto Pizza
40,60,99.1,104.32,144.97,2118.41,Mediterranean Naan Pizza
40,60,89.62,205.69,114.48,2211.56,Mediterranean Hummus Pizza
40,60,27.54,177.77,57.07,1334.87,Mediterranean Meatless Pizza
40,60,69.57,257.77,77.07,2002.99,Mediterranean Pizza Pocket
40,60,44.15,108.14,152.42,1980.94,Mediterranean Tortellini Salad
40,60,143.8,18.11,161.24,2098.8,Mediterranean Chicken Panini
40,60,78.1,205.28,66.05,1727.97,Mediterranean Tuna Pizza
40,60,134.36,151.1,92.61,1975.33,Grilled Mediterranean Pizza
40,60,60.98,119.92,90.42,1537.38,Mediterranean Tortilla Pizza
40,60,54.64,29.97,84.16,1095.88,Mediterranean Tomatoes & Mozzarella
40,60,99.42,287.03,81.28,2277.32,Mediterranean Tortellini Salad
40,60,370.85,86.18,160.17,3269.65,Mediterranean Pizza recipes
40,60,189.16,525.3,209.89,4746.85,Chicken Mediterranean Pizza
40,60,109.51,146.24,109.73,2010.57,Mediterranean Vegetable Pizza
40,60,141.2,146.67,184.09,2808.29,Mediterranean lamb pizza
40,60,42.1,172.33,30.48,1132.04,Mediterranean Pita Pizzas
40,60,37.44,93.87,54.63,1016.91,Mediterranean Socca Pizza
40,60,98.21,362.25,126.16,2977.28,Penne Rigate with Mixed Greens and Pine Nuts
40,60,396.48,370.46,589.02,8368.94,Mediterranean Pita Pizzas
40,60,90.49,185.8,124.37,2224.49,Mediterranean baguette pizza
40,60,140.19,229.04,88.4,2272.52,Veggie Frittata Breakfast Sandwiches
40,60,73.29,151.48,57,1412.08,Mediterranean lamb pizza
50,60,2.28,11.32,7.3,120.1,Lemon-Basil Risotto with Tomato Topping
50,60,51.86,169.4,30.88,1162.96,I Love Ny Veggie Pizza
50,60,65.15,303.67,36.05,1799.73,"Garganelli Pasta with Scallops, Tomatoes and Green Beans"
50,60,50.91,31.1,84.27,1086.47,Pepperoni Pizza Wrap
50,60,72.88,388.59,124.26,2964.22,Pink Pasta
50,60,57.42,217.37,45.53,1508.93,Pasta with tuna and roasted asparagus
50,60,315.57,424.32,326.86,5901.3,Stuffed Shells with Creamy Tomato Parmesan Sauce
50,60,64.63,207.5,139.97,2348.25,Carrot Gnocchi with Chard two ways
50,60,24.56,37.88,24.28,468.28,kale and cheese calzone
50,60,23.91,41.84,11.13,363.17,Cod with Rosemary Polenta and Beans
50,60,72.76,130.13,59.23,1344.63,Burrata Pizza
50,60,223.44,468.96,277.66,5268.54,Macaroni and Cheese
50,60,5.14,63.09,2.9,299.02,Sweet Potato Julius
50,60,80.04,3.94,60.14,877.18,Fiesta Chicken Drummettes
50,60,186.16,105.55,210.63,3062.51,Pizza in a bread bowl Recipe
50,60,0.11,6.62,0,26.92,The Sherry Martini
50,60,20.07,4.42,21.83,294.43,Spinach and Italian Cheese Omelet
50,60,143.09,221.09,106.68,2416.84,Eggplant Lasagna
50,60,135.94,210.92,139.86,2646.18,Creamy Pesto Tiger Shrimp and Asparagus Lasagna Bundles
50,60,287.78,73.74,85.09,2211.89,Sweet and Salty Prosciutto-Wrapped Asparagus
50,60,66.49,63.92,28.47,777.87,Gabriella's Farmer Cheese Gnocchi
50,60,14.76,47.42,96.49,1117.13,Charred Onion Dip
50,60,0.08,19.03,0.17,77.97,Blackthorn Cocktail Recipe
50,60,35.31,145.17,60.43,1265.79,Sage-Butter Gnocchi recipes
50,60,66.49,6.44,94.97,1146.45,Deviled Eggs
50,60,66.49,63.92,28.47,777.87,Gabriella's Farmers Cheese Gnocchi
50,60,24.7,75.98,60.12,943.8,Endive with sweet cheese
50,60,43.62,36.3,32.35,610.83,Seafood Pizza
50,60,66.49,6.44,94.97,1146.45,Deviled Eggs
50,60,89.49,310.5,73.18,2258.58,Lemon-Basil Risotto with Tomato Topping
50,60,24.2,33.28,15.96,373.56,Tuna-Quinoa Toss
50,60,69.02,95.75,58.41,1184.77,Broccoli Chicken Tortellini
50,60,66.49,6.44,94.97,1146.45,Spicy Deviled Eggs
50,60,6.17,20.92,4.17,145.89,Butternut Souffle
50,60,98.55,134.91,37.38,1270.26,Chicken chow mein
50,60,37.1,179.31,79.93,1585.01,Porcini Mushroom Risotto
50,60,93.43,344.51,88.59,2549.07,Commodity Pasta
50,60,268.39,213.68,246.97,4151.01,Creamy Tomato Lasagna
50,60,36.61,85.51,30.3,761.18,Hand-Formed Parmesan Tater Tots
50,60,9.97,54.46,0.5,262.22,Couscous with Orange
50,60,9.98,70.43,23.38,532.06,Green Beans with Caramelized Onions
50,60,51.79,191.02,56.56,1480.28,"Strawberry, Arugula, And Goat Cheese Pizza"
50,60,9.18,18.61,7.48,178.48,Prosciutto-Melon Toast
50,60,71.88,86.68,47.81,1064.53,Zucchini Custards with Tomatoes and Basil
50,60,37.88,9.08,56.85,699.49,Bacon Cheddar Frittata
50,60,29.48,191.81,161.76,2341,Tiramisu Truffles
50,60,20.46,122.46,48.55,1008.63,Cheddar Potato Casserole
50,60,178.89,83.44,230.66,3125.26,Chicken Sicilian
